<?xml version="1.0" encoding="UTF-8" standalone="yes"?>
<allAtts xmlns:xsi='http://www.w3.org/2001/XMLSchema-instance'
  xsi:noNamespaceSchemaLocation='atts.xsd'>
    <attribute catId="1" id="cat1_1" label="att1 cat1" code="att1_cat1">
        <choice label="choice 1" id="cat1_1_1" code="choice_111"/>
        <choice label="choice 2" id="1_1_2" />
        <choice label="choice 3" id="1_1_3" code="choice_113"/>
        <choice label="choice 4" id="1_1_4" code="choice_114"/>
        <choice label="choice 5" id="1_1_5" code="choice_115"/>
    </attribute>
      
    <attribute catId="2" id="cat2_1" label="att1 cat2" code="att1_cat2">
        <choice label="choice 1" id="2_1_1" code="choice_211"/>
        <choice label="choice 2" id="2_1_2" code="choice_212"/>
        <choice label="choice 3" id="2_1_3" code="choice_213"/>
    </attribute>
    
    <attribute catId="2" id="cat2_2" label="att2 cat2" code="att2_cat2">
        <choice label="choice 1" id="2_2_1" code="choice_221"/>
        <choice label="choice 2" id="2_2_2" code="choice_223"/>
        <choice label="choice 3" id="2_2_3" code="choice_223"/>
    </attribute>    
</allAtts>